{
  "format": "cognipace-content",
  "version": 1,
  "problems": [
    {
      "slug": "two-sum",
      "title": "Two Sum",
      "difficulty": "easy",
      "companies": ["Example Company"],
      "topics": ["Array"]
    }
  ],
  "companies": ["Example Company"],
  "topics": ["Array"],
  "tracks": [
    {
      "slug": "interview-essentials",
      "title": "Interview Essentials",
      "groups": [
        {
          "slug": "arrays",
          "title": "Arrays",
          "problems": ["two-sum", "contains-duplicate"]
        }
      ]
    }
  ]
}
